{
  "receipt_id": "receipt_a1b2c3d4e5f6g7h8",
  "session_id": "sess_f8e7d6c5b4a39281",
  "actor_id": "actor_arif_sovereign",
  "principal_id": "ARIF",
  "operator_id": "agent_FORGE_000",
  "agent_id": "FORGE_000",
  "tool_id": "geox_compute",
  "organ": "GEOX",
  "tool_name": "geox_compute",
  "action_class": "COMPUTE",
  "authority_scope": "compute",
  "input_hash": "a1b2c3d4e5f60718a1b2c3d4e5f60718a1b2c3d4e5f60718a1b2c3d4e5f60718",
  "output_hash": "b2c3d4e5f6071809b2c3d4e5f6071809b2c3d4e5f6071809b2c3d4e5f6071809",
  "timestamp": "2026-07-07T14:30:00Z",
  "epistemic_status": "DER",
  "evidence_layer": "L2_VERIFIED_STATE",
  "authority_claim": "ADVISORY",
  "reversibility": "REVERSIBLE",
  "mutation": {
    "type": "none",
    "scope": "local",
    "reversible": true,
    "rollback_path": null
  },
  "external_side_effect": {
    "present": false,
    "description": null,
    "blast_radius": "LOW"
  },
  "witnesses": [
    {
      "witness_id": "w_trace_geox_compute_001",
      "witness_type": "EXECUTION_TRACE",
      "independence_class": "SAME_TOOL",
      "signature": null,
      "evidence": "Tool executed successfully with output hash verification."
    }
  ],
  "dependencies": [],
  "floor_results": {
    "F1": {
      "status": "PASS",
      "reason": "Computation is reversible; no external state mutation."
    },
    "F2": {
      "status": "PASS",
      "reason": "Evidence layer L2 declared; epistemic status DER."
    },
    "F3": {
      "status": "PASS",
      "reason": "Output aligns with input intent: petrophysical computation."
    },
    "F4": {
      "status": "PASS",
      "reason": "Verdict explicit: ADVISORY computation result."
    },
    "F5": {
      "status": "PASS",
      "reason": "No escalation of harm or conflict."
    },
    "F6": {
      "status": "PASS",
      "reason": "No dignity, culture, or human standing degraded."
    },
    "F7": {
      "status": "PASS",
      "reason": "Unknowns declared in epistemic_status (DER, not OBS)."
    },
    "F8": {
      "status": "PASS",
      "reason": "Action is safe and legal: standard petrophysical computation."
    },
    "F9": {
      "status": "PASS",
      "reason": "No hallucinated files, tools, or seals."
    },
    "F10": {
      "status": "PASS",
      "reason": "No AI claiming human status."
    },
    "F11": {
      "status": "PASS",
      "reason": "Authority sufficient for compute scope."
    },
    "F12": {
      "status": "PASS",
      "reason": "No bypass attempt detected."
    },
    "F13": {
      "status": "PASS",
      "reason": "No irreversible action; no veto required."
    }
  },
  "verdict_request": {
    "requested": false,
    "reason": null
  },
  "vault999_status": "NONE"
}
